{
  "kind": "build-artifact", "identity": "louke.contract.v0.14-002.build-artifact", "revision": "prism-round-3-remediation-candidate",
  "schema_ref": {"identity": "louke.machine-contract.build-artifact", "version": "1.0.0", "digest": "sha256:1c0f0830775275db5114e8ed3f52cab4eb809b01384cffe3e963ab025057b750"},
  "manifest_ref": {"identity": "louke.design-artifacts.v0.14-002.prism-r3-remediation", "revision": "prism-round-3-remediation-candidate"},
  "scope": {"workspace_id": "github.com/zillionare/louke", "spec_id": "v0.14-002-workflow-reflow-design", "base_commit": "2734177ef5398e4c10a1f68039ec469ccc21f2b8", "project_facts_digest": "sha256:4b1a523c1cf946b480162e5321d3c92aeebdea75f57d5768948aee6f76672130", "project_facts_artifact": {"kind": "host-project-facts-snapshot", "path": "design-artifacts/inputs/host-project-facts.snapshot.json", "identity": "louke.host-project-facts.github.com-zillionare-louke", "revision": "base-2734177-workspace-2026-07-20-r2"}, "release_identity": "0.14.0"}, "generated_by": {"owner": "Runtime/program", "role": "Archer", "task_manifest_digest": "sha256:0a9d58474340e9520af49d2bea462c41533c1fabc81afbcf4f5f292caecefbfc", "task_manifest_artifact": {"kind": "archer-author-task-manifest", "path": "design-artifacts/inputs/archer-author-task-manifest.candidate.json", "identity": "runtime.v0.14-002.m-design.archer.prism-r3-remediation", "revision": "prism-round-3-remediation-candidate"}}, "compatible_runtime": ">=0.14.0,<0.15.0",
  "artifact_refs": [
    {"path": ".louke/project/specs/v0.14-002-workflow-reflow-design/test-plan.md", "digest": "sha256:02a928e09f4abc80ae6ec0c60ec39ba33a131cfd5acc47dc3daeeab97cb4d53e", "ac_ids": ["AC-FR1500-01","AC-FR1700-01","AC-FR1800-01","AC-FR1900-01","AC-FR2000-01"], "interface_ids": ["IF-CON-01","IF-REG-01","IF-REL-01","IF-BLD-01","IF-PRM-01","IF-REV-01"], "architecture_anchors": ["ARC-REGISTRY","ARC-CONTRACTS","ARC-PROMPTS","ARC-VERSION","ARC-BUILD","ARC-PUBLISH","ARC-REVIEW","ARC-STORE","ARC-SECURITY"], "contract_kind": "build-artifact"},
    {"path": ".louke/project/specs/v0.14-002-workflow-reflow-design/interfaces.md", "digest": "sha256:ce4e83ae0d0f614a43a1912e317859105f84f08ba53fc3e8b1cc150dd108e37f", "ac_ids": ["AC-FR1500-01"], "interface_ids": ["IF-BLD-01"], "architecture_anchors": ["ARC-BUILD","ARC-VERSION","ARC-PUBLISH"], "contract_kind": "build-artifact"},
    {"path": ".louke/project/specs/v0.14-002-workflow-reflow-design/architecture.md", "digest": "sha256:32c88eb2062eb0173738086202eddf87122204ee99d32133c1ea30a6c39335cc", "ac_ids": ["AC-FR1500-01","AC-FR1700-01"], "interface_ids": ["IF-BLD-01","IF-PRM-01"], "architecture_anchors": ["ARC-BUILD","ARC-VERSION","ARC-PROMPTS"], "contract_kind": "build-artifact"}
  ],
  "payload": {"commands": [{"id":"build","cwd":"isolated clean workspace","command":"python -m build","implementation_state":"existing","success":"exactly required wheel and sdist produced after version prepare","failure":"nonzero,timeout,missing/extra ambiguous release artifacts fail"},{"id":"inspect","cwd":".","command":"python tools/louke_python_release_adapter.py inspect --artifact PATH","implementation_state":"existing","success":"each artifact reports kind and 0.14.0 then clean-install outlets match","failure":"extract/digest/version/prompt/schema/outlet missing,mismatch or unknown fails"}], "prepare_version":"python tools/louke_python_release_adapter.py prepare --tag v0.14.0","build_command":"python -m build","artifacts":[{"id":"wheel","glob":"dist/louke-*.whl","required":true,"extract_command":"python tools/louke_python_release_adapter.py inspect --artifact PATH","digest_algorithm":"sha256","installed_outlets":["lk --version","python -c importlib.metadata.version('louke')","installed Archer/Prism prompt bundle readback","installed registry/schema readback"]},{"id":"sdist","glob":"dist/louke-*.tar.gz","required":true,"extract_command":"python tools/louke_python_release_adapter.py inspect --artifact PATH","digest_algorithm":"sha256","installed_outlets":["lk --version","python -c importlib.metadata.version('louke')","installed Archer/Prism prompt bundle readback","installed registry/schema readback"]}],"comparison":"every extracted and installed version exactly 0.14.0; prompt source/bundle and registry/schema digests match reviewed candidate/activated identities","ordered_gate":["prepare or validate version source","real build","enumerate every required artifact","SHA-256/extract/compare each artifact","clean-install each artifact and read public outlets"],"evidence":["version-scheme-selected","version-source-prepared","artifacts-built","artifact-versions-verified"], "failure_policy": {"fail_closed": true, "non_success": ["identity-invalid","source-failure","build-failure","artifact-missing","extract-failure","version-mismatch","prompt-or-schema-mismatch","outlet-mismatch","unknown"], "current_state": "candidate-not-installed"}}
}
